{
  "slug": "_template",
  "title": "",
  "description": "",
  "type": "prototype",
  "project_status": "live",
  "thumbnail_url": "",
  "live_demo_url": "",
  "github_url": "",
  "website_url": "",
  "context_challenge": "",
  "solution_process": "",
  "artifacts_deliverables": "",
  "outcome_impact": "",
  "featured": false,
  "status": "draft",
  "display_order": 0
}
